commit	val_bpb	memory_gb	status	description
21b86c4	1.379616	0.0	keep	baseline: depth=4 dim=256 11.5M params
6e4ab46	1.764969	0.0	discard	depth=8 dim=512 50M params — only 69 steps on MPS too slow
352cab4	1.475373	0.0	discard	HEAD_DIM=64 4 heads dim=256 — 205 steps MPS inefficient
5068279	1.360532	0.0	keep	TOTAL_BATCH_SIZE=2^15 half batch 2x steps — improved
a20e8a2	0.000000	0.0	crash	TOTAL_BATCH_SIZE=2^14 DEVICE_BATCH_SIZE=16 assert fail
097c37a	1.347712	0.0	keep	TOTAL_BATCH_SIZE=2^14 DEVICE_BATCH_SIZE=8 890 steps — best
515fa11	1.366126	0.0	discard	TOTAL_BATCH_SIZE=2^13 DEVICE_BATCH_SIZE=4 too small batch
709e870	1.350212	0.0	discard	MATRIX_LR=0.06 no improvement
f2a77ac	1.352478	0.0	discard	WARMDOWN_RATIO=0.3 worse than 0.5
4b95143	1.349630	0.0	discard	WINDOW_PATTERN=SSSL marginal worse
e31ada2	1.350980	0.0	discard	WEIGHT_DECAY=0.0 no improvement
aafa1b3	1.411615	0.0	discard	MPS pre-warmup caused memory fragmentation — 545 steps only
8a3c8b3	1.407629	0.0	discard	FINAL_LR_FRAC=0.1 — battery throttle 546 steps invalid
3162c27	1.390246	0.0	discard	WARMDOWN_RATIO=0.7 — still battery throttle 650 steps invalid
f472dd3	1.350705	0.0	keep	verification run power adapter 866 steps — baseline confirmed
c2dce74	1.350615	0.0	discard	WARMDOWN_RATIO=0.7 retry power adapter — no improvement vs 0.5
cb0cffd	1.348923	0.0	discard	FINAL_LR_FRAC=0.1 retry power adapter — within noise no improvement
bfb4d3a	1.351719	0.0	discard	Muon momentum ramp 300->200 steps — no improvement
4dcbd7b	1.364248	0.0	discard	DEPTH=3 1047 steps — more steps but shallower model worse val_bpb
9ff0a21	1.354677	0.0	discard	ADAM_BETAS=(0.9,0.95) higher beta1 — worse than (0.8,0.95)
368e51c	1.348183	0.0	discard	EMBEDDING_LR=0.8 — within noise of best no improvement
ad52500	1.354906	0.0	discard	WARMUP_RATIO=0.05 — warmup consumes training budget, worse
ef954af	1.343433	0.0	keep	SCALAR_LR=1.0 EMBEDDING_LR=0.5 MATRIX_LR=0.025 — NEW BEST
